{
  "schema_version": 1,
  "node_id": "xworkmate-bridge",
  "generation": 42,
  "issued_at": "2026-08-27T10:00:00Z",
  "expires_at": "2026-08-28T10:00:00Z",
  "min_gateway_version": "0.1.0",
  "interface": {
    "name": "wg-xwm",
    "address": "172.29.10.1/24",
    "listen_port": 51820
  },
  "peers": [
    {
      "device_id": "shenlan-macos",
      "public_key": "jfHsw1HIqRQzGvfsRfdkS7BLThDbBvWMsAlJRp1kdkw=",
      "allowed_ips": ["172.29.10.100/32"]
    }
  ],
  "policy": {
    "revision": 7,
    "artifact_hash": "sha256:fixture-policy",
    "rules": []
  },
  "transport": {
    "proxy_core": "xray",
    "runtime_config": {
      "log": {"loglevel": "warning"},
      "inbounds": [],
      "outbounds": []
    }
  },
  "signature": {
    "key_id": "overlay-config-2026-01",
    "algorithm": "Ed25519",
    "value": "fixture-signature"
  }
}
